{
  "commit_count": 8,
  "completed_stations": 6,
  "effort": "Muy Alto",
  "model": "GPT-5.6 Luna",
  "notes": [
    "Operator supplied after the original capture.",
    "Visible duration and quota values are operator-reported and are not inferred from repository telemetry."
  ],
  "original_event_id": "ui_ux_1_202_selection_learning_event",
  "planned_stations": 6,
  "quota_5h_delta": 4,
  "quota_5h_end_remaining": 78,
  "quota_5h_start_remaining": 82,
  "quota_weekly_delta": 1,
  "quota_weekly_end_remaining": 94,
  "quota_weekly_start_remaining": 95,
  "reported_at": "2026-09-08T00:00:00+00:00",
  "result": "PASS",
  "schema_version": "gokv.operator_measurement_supplement.v1",
  "source": "OPERATOR_REPORTED",
  "supplement_id": "ui_ux_1_202_operator_measurement_supplement",
  "visible_duration": "19m54s"
}
